Managed Funds Performance - Rankings & Ratings,,,,,,,,,,,,,,,,,,,,
Latest available data as at: 5/8/2015,,,,,,,,,,,,,,,,,,,,
Performance as at: 30/6/2015,,,,,,,,,,,,,,,,,,,,
Product Star Ratings as at: 30/6/2015,,,,,,,,,,,,,,,,,,,,
"Processed Saturday at 2015-08-08T13:30:01+10:00.",,,,,,,,,,,,,,,,,,,,
,,,,,,,,,,,,,,,,,,,,
,,,,,,,,,,,,,,,,,,,,
,,,,,,,,,,,,,,,,,,,,
"HOW TO READ THE MANAGED FUNDS TABLES:  Tables show unit trusts. Funds are then grouped together by the assets they invest in, showing latest-available entry and exit prices, one- and three-year returns, and Morningstar Rating from one to five stars. Funds are ranked by alphabetical order within categories. The Morningstar Rating is an assessment of a fund's past performance - based on both return and risk - which shows how similar investments compare with their competitors. A high rating alone is insufficient basis for an investment decision. Questions/More Information: Phone 1 800 03 44 55 or online help.au@morningstar.com",,,,,,,,,,,,,,,,,,,,,,,
"COPYRIGHT:  Morningstar Australasia Pty Ltd (Morningstar) ABN: 95 090 665 544, AFSL: 240892 (a subsidiary of Morningstar, Inc).",,,,,,,,,,,,,,,,,,,,,,,
"DISCLAIMER:  The data and content contained herein are not guaranteed to be accurate, complete or timely. Neither Morningstar, nor its affiliates nor their content providers will have any liability for use or distribution of any of this information. To the extent that any of this information constitutes advice, it is general advice that has been prepared by Morningstar without reference to your objectives, financial situation or needs. Before acting, you should consider the appropriateness of the advice and obtain financial, legal and taxation advice before making any financial investment decision. Investors should obtain the relevant product disclosure statement and consider it before making any decision to invest. Please refer to our Financial Services Guide (FSG) for more information at www.morningstar.com.au/fsg.asp",,,,,,,,,,,,,,,,,,,,,,,
,,,,,,,,,,,,,,,,,,,,,,,
Fund Name,Entry Price,Exit Price,1 Yr Perf,3 Yr Perf,Star Rating,,,,,,,,,,,,,,,
,
,
INVESTMENT TRUSTS,,
Multisector Aggressive,,
Advance Growth Multi-Blend W,1.0898,1.0850,7.20,12.38,**,,
Advance High Growth Multi-Blend W,1.0653,1.0601,9.44,14.72,***,,
AMP Gen-Growth,1.0772,1.0714,9.34,15.38,***,,
AMP Gen-High Growth,1.0832,1.0768,10.71,17.41,***,,
BT Class Inv Split Growth,3.6381,3.6315,18.25,21.74,****,,
BT Future Goals Retail,2.0105,2.0042,11.77,14.10,***,,
Ibbotson Dynamic Growth Trust,1.1278,1.1240,14.46,16.64,***,,
IOOF MultiMix Growth Trust,1.1347,1.1279,12.78,16.85,***,,
IOOF Profile 95,0.9779,0.9761,12.14,17.85,****,,
ipac Pathways 85,1.0144,1.0092,10.49,16.20,****,,
ipac Pathways 95,0.9697,0.9647,11.78,17.81,****,,
ipac Strat Inv Srv Inflation Plus 6,1.1890,1.1823,9.50,15.13,***,,
MLC UT/MKey InvSerHorizon 5 - Growth,1.3492,1.3465,10.57,14.76,***,,
North Index Growth,0.8199,0.8175,11.35,16.27,****,,
North Index High Growth,0.7079,0.7058,12.47,18.75,*****,,
Russell Growth A,1.0490,1.0445,11.03,16.01,***,,
Russell Growth C,1.1102,1.1055,10.79,15.77,***,,
SUMMIT Select - Active Growth Units,1.0222,1.0167,10.47,16.56,****,,
UCA Growth Portfolio,4.6626,4.6347,12.10,15.33,NAv,,
Multisector Balanced,,
Advance Moderate Multi-Blend W,1.0886,1.0850,4.75,8.38,***,,
AMP Gen-Moderately Defensive,1.0542,1.0500,6.37,10.32,***,,
AMS Moderately Conservative Fund,1.0302,1.0271,NAv,NAv,NAv,,
Australian Ethical Balanced Trust,1.3941,1.3938,8.45,12.00,**,,
CFS FC Inv-FirstChoice Moderate,1.1558,1.1523,8.02,11.09,***,,
CFS FC W Inv-CFS W Balanced,1.1888,1.1853,6.94,10.24,***,,
CFS FC W Inv-FirstChoice W Moderate,1.1681,1.1646,8.98,12.08,****,,
Ibbotson Balanced Growth Trust,1.0044,1.0016,9.23,10.69,***,,
IOOF Multi Series Balanced Trust,0.9215,0.9177,10.90,13.77,****,,
IOOF MultiMix Moderate Trust,1.0982,1.0932,8.65,10.98,***,,
IOOF Profile 55,0.9952,0.9942,7.19,10.96,***,,
ipac Classic Value Portfolio,1.0094,1.0047,7.68,11.63,***,,
MLC UT/MKey InvSer Horizon 3-Conserv Gr,1.0693,1.0683,7.45,9.85,**,,
MLC Wholesale Horizon 3 Conservative Gr,1.1383,1.1366,8.43,10.82,****,,
Netwealth Active Balanced,0.7668,0.7642,9.14,11.98,****,,
North Index Moderately Defensive,1.0071,1.0045,8.36,10.97,****,,
North Select Income Generator,1.1812,1.1766,7.75,11.06,****,,
Pre Select Balanced,1.2252,1.2222,8.47,11.34,*****,,
Russell Diversified 50 A,1.0682,1.0643,8.05,11.22,****,,
Schroder Real Return CPI+5% Wholesale,1.1588,1.1542,6.08,8.04,*,,
SUMMIT Select - Active Mod Defensive,1.1011,1.0967,7.46,11.42,****,,
Summit Select Income Generator,1.1812,1.1766,7.75,11.06,****,,
UBS Tactical Beta Fund - Balanced,1.1428,1.1394,7.67,NAv,NAv,,
Multisector Conservative,,
North Multi Manager Active Defensive,0.9962,0.9938,6.61,8.42,*****,,
Multisector Growth,,
Advance Balanced Multi-Blend W,1.1658,1.1612,6.51,10.92,***,,
AMP FLI-AMP Balanced Growth,1.1671,1.1618,9.12,13.01,**,,
AMP Gen-Balanced,1.0590,1.0539,8.22,13.33,***,,
BT Active Bal WS,1.8011,1.7958,11.28,13.12,****,,
BT Investor Choice Bal Gr,1.3083,1.3038,9.17,11.61,***,,
BT Multi-Manager Bal Retail,1.0953,1.0910,5.40,9.78,*,,
CBA Balanced,NAv,1.5699,6.97,10.28,**,,
CBA Growth,NAv,1.7611,8.97,12.80,***,,
CFS FC Inv-FirstChoice Growth,1.2006,1.1958,9.30,13.46,***,,
CFS FC W Inv-CFS W Diversified,1.7148,1.7079,8.91,13.72,***,,
CFS FC W Inv-FC W Multi-Index Balanced,1.0758,1.0725,7.68,13.25,****,,
CFS FC W Inv-FirstChoice W Growth,1.2068,1.2020,10.31,14.53,****,,
CFS MIF-Diversified,1.9956,1.9877,7.99,12.76,**,,
DMG Diversified Portfolio,1.0896,1.0842,9.90,NAv,NAv,,
EQT Growth,1.5140,1.5079,9.11,14.11,NAv,,
Fiducian Balanced,1.3046,1.2981,11.78,14.25,***,,
IOOF MultiMix Balanced Growth Trust,1.1687,1.1627,10.93,14.54,***,,
IOOF Profile 75,1.0079,1.0065,9.30,14.28,***,,
ipac Classic Portfolio 2,0.9344,0.9296,8.39,13.35,***,,
ipac Pathways 70,0.9941,0.9890,9.00,14.04,***,,
ipac Strat Inv Srv Inflation Plus 4,1.1145,1.1088,8.03,13.01,***,,
Macquarie Balanced Growth,1.1114,1.1076,8.69,12.40,NAv,,
MLC UT/MKey InvSer Horizon 4 - Balanced,1.5061,1.5031,9.20,12.73,***,,
MLC Wholesale Horizon 4 Balanced,1.1547,1.1524,10.19,13.74,****,,
MLC Wholesale Inflation Plus - Moderate,1.0854,1.0833,10.97,NAv,NAv,,
North Guardian Balanced,1.1283,1.1255,9.10,NAv,NAv,,
North Index Balanced,0.9036,0.9011,9.95,13.91,****,,
North Multi Manager Active Growth,0.8650,0.8607,11.69,17.26,*****,,
North Multi Manager Balanced,0.9987,0.9944,10.09,14.80,*****,,
OnePath OA IP-OP Tax Effective Inc NE,1.7079,1.7079,4.90,10.50,*,,
Perpetual Wholesale Balanced Growth,1.5022,1.4971,7.05,13.92,****,,
Russell Balanced A,1.0245,1.0205,9.62,13.77,****,,
Russell Balanced Class C,1.1042,1.0998,9.38,13.55,***,,
SUMMIT Select - Active Balanced,1.0711,1.0660,9.35,14.50,****,,
UBS Balanced Investment,1.4124,1.4067,9.40,15.17,****,,
Multisector Moderate,,
Advance Defensive Multi-Blend W,1.1042,1.1012,2.95,5.83,***,,
BT Investor Choice Mod Gr,1.1052,1.1026,6.27,7.23,***,,
CFS FC Inv-FirstChoice Conservative,1.0826,1.0793,5.32,6.88,**,,
CFS FC W Inv-CFS W Conservative,1.1950,1.1926,6.32,8.09,****,,
CFS FC W Inv-FC W Multi-Index Cons,0.9703,0.9684,5.34,7.60,***,,
CFS FC W Inv-FirstChoice W Conservative,1.1011,1.0978,6.14,7.71,****,,
Ibbotson Conservative Growth Trust,1.0062,1.0042,6.56,7.78,***,,
IOOF MultiMix Conservative Trust,1.0196,1.0170,6.47,8.42,****,,
ipac Pathways 30,0.9920,0.9883,5.20,8.11,***,,
Mercer Conservative Growth,1.0082,1.0057,6.64,7.06,***,,
MLC UT/MKey InvSer Horizon 2 - Income,1.1618,1.1607,5.63,6.99,**,,
MLC Wholesale Horizon 2 Income Portfolio,1.0902,1.0891,6.70,7.99,****,,
North Index Defensive,1.0226,1.0204,6.55,8.13,****,,
North Multi Manager Active Moderately De,0.9571,0.9539,8.53,11.68,*****,,
Perpetual Wholesale Conservative Growth,1.1524,1.1494,4.90,8.55,*****,,
Russell Conservative A,0.9551,0.9522,6.27,8.31,*****,,
UBS Defensive Investment,1.2294,1.2257,7.06,10.34,*****,,
Alternative Strategies,,
Atrium Evolution Series Divers - AEF 7,1.2614,1.2558,11.15,11.88,NAv,,
Atrium Evolution Series Divers - AEF 9,1.2925,1.2869,12.73,13.47,NAv,,
Bennelong Kardinia Absolute Return,1.1881,1.1834,8.23,9.77,NAv,,
K2 Australian Absolute Return,182.1300,180.6700,11.05,16.36,NAv,,
K2 Select International Absolute Return,151.4300,150.2300,31.82,20.91,NAv,,
Perpetual Pure Equity Alpha,1.0774,1.0731,8.82,10.56,NAv,,
UBS Dynamic Alpha Strategies Fund A,1.1634,1.1587,7.27,9.80,NAv,,
WaveStone Dynamic Australian Equity,1.5379,1.5317,10.13,17.61,NAv,,
Alternative Strategies - Diversified,,
Advance Alternative Strats Multi-Blend,1.0447,1.0393,0.10,3.54,NAv,,
Ironbark Global Diversified Alternatives,1.1535,1.1535,6.41,5.44,NAv,,
Alternative Strategies - Managed Futures,,
Aspect Diversified Futures-Class A,1.2413,1.2413,23.71,5.21,***,,
Winton Global Alpha,1.2110,1.1994,13.14,9.61,****,,
Equity Asia Pacific w/o Japan,,
Aberdeen Asian Opportunities,2.8182,2.7874,21.65,16.93,***,,
BT Asian Share Retail,8.3954,8.3534,27.00,17.57,***,,
Macquarie Asia New Stars No.1,1.8628,1.8442,50.80,37.25,*****,,
Platinum Asia,3.0346,3.0194,29.87,25.16,*****,,
Schroder Asia Pacific,1.8878,1.8746,24.03,20.27,****,,
Equity Australia Derivative Income,,
CFS FC W Inv-CFS W Equity Income,0.7797,0.7766,2.40,10.79,***,,
Merlon WS Australian Share Income,1.1247,1.1203,4.89,12.50,***,,
Zurich Investments Equity Income,0.7005,0.6991,0.89,9.70,***,,
Equity Australia Large Blend,,
AMP Gen-BlackRock Aust Equity Index,1.3069,1.3037,4.28,13.11,**,,
Antares Prof Elite Opportunities,1.2673,1.2635,6.08,14.87,****,,
Antares Prof High Growth Shares,1.0908,1.0876,8.42,15.57,*****,,
BlackRock Australian Share,1.6725,1.6633,-0.13,11.15,**,,
BT Aus Share Retail,3.9278,3.9082,7.51,15.57,****,,
BT Imp Shr Retail,1.8420,1.8330,5.97,13.29,***,,
BT Investor Choice Aus Tax Eff,1.8842,1.8748,4.75,14.57,****,,
CFS FC W Inv-CFS W Aus Share Core,1.5412,1.5351,6.00,14.35,****,,
CFS FC W Inv-CFS W Imputation,2.6663,2.6557,6.01,15.72,****,,
CFS FC W Inv-CFS W Index Australian Shr,1.0976,1.0954,5.37,14.67,***,,
CFS MIF-Imputation,3.8542,3.8389,5.12,14.76,***,,
CFS Wholesale Australian Share,2.0286,2.0205,7.37,17.40,****,,
EQT Flagship Common No 2,1.9203,1.9076,10.32,15.15,****,,
Fidelity Australian Equities,29.5632,29.4158,6.73,17.23,*****,,
Fiducian Australian Shares,1.6557,1.6458,7.28,14.81,***,,
Ibbotson Australian Shares High Alpha Tr,1.1759,1.1700,6.41,14.90,****,,
IOOF MultiMix Australian Shares Trust,1.0697,1.0643,4.60,14.43,***,,
Macquarie Aus Pure Indexed Equities,1.7755,1.7667,5.44,14.50,***,,
MLC UT/MKey InvSer MLC - Vanguard Sh Ind,2.4622,2.4597,4.13,13.37,**,,
Pengana Australian Equities Class A,1.7457,1.7370,8.89,13.79,****,,
Russell Australian Share A,1.5666,1.5588,5.65,15.53,***,,
UBS Australian Share,1.8875,1.8780,3.92,14.83,****,,
UCA Australian Equities Portfolio,12.9021,12.8249,7.57,13.21,NAv,,
Vanguard Index Australian Shares,2.0785,2.0743,4.87,13.91,***,,
Westpac Aus Tax Eff Retail,0.9210,0.9164,4.16,13.95,***,,
Equity Australia Large Geared,,
CFS FC W Inv-CFS W Geared Share,4.5749,4.5356,12.96,34.27,***,,
CFS MIF-Geared Share,2.2937,2.2740,11.94,32.97,***,,
Perpetual Wholesale Geared Australian,2.4740,2.4555,-1.65,29.58,****,,
Equity Australia Large Growth,,
Arnhem Australian Equity,1.7944,1.7837,3.00,15.15,****,,
Ausbil Australian Active Equity,3.5034,3.4825,4.20,16.18,****,,
Greencape Wholesale Broadcap,1.3195,1.3143,3.92,16.27,****,,
Greencape Wholesale High Conviction,1.3357,1.3303,6.27,16.07,****,,
Hyperion Australian Growth Companies,3.4412,3.4206,5.91,20.16,*****,,
Platypus Australian Equities - Wholesale,1.3483,1.3429,8.62,16.25,****,,
Russell Aust Opportunities Class A,1.3172,1.3080,5.36,15.05,***,,
Equity Australia Large Value,,
Antares Prof Dividend Builder,1.3121,1.3081,12.22,19.83,****,,
CFS FC Inv-Perpetual Industrial Shr,1.5010,1.4950,6.37,17.45,****,,
Maple-Brown Abbott Aus Shr Retail,1.2110,1.2110,5.02,15.21,**,,
Maple-Brown Abbott Aus Shr Wholesale,1.2199,1.2148,6.33,16.64,***,,
Maple-Brown Abbott Sharemarket,1.0410,1.0410,5.51,15.66,**,,
MLC UT/MKey InvSer Income Builder,2.7916,2.7832,9.23,17.77,***,,
Perennial Value Shares Wholesale Trust,1.3398,1.3318,8.29,17.15,***,,
Perpetual W Share Plus L/S,2.6680,2.6573,7.74,21.19,*****,,
Perpetual WFIA-Perpetual Aus Shr,2.7263,2.7181,1.31,14.21,***,,
Perpetual WFIA-Perpetual Indl Shr,2.2194,2.2128,6.34,17.55,****,,
Perpetual WFI-Perpetual Indl Shr,1.7585,1.7533,6.60,17.63,****,,
Perpetual Wholesale Australian,1.4258,1.4216,2.39,15.37,***,,
Perpetual Wholesale Concentrated Equity,1.6779,1.6729,4.88,17.42,*****,,
Perpetual Wholesale Ethical SRI,2.0081,2.0021,10.37,21.12,*****,,
Perpetual Wholesale Industrial,1.4101,1.4059,7.57,18.74,****,,
Realindex Australian Share-Class A,1.2327,1.2303,4.17,15.09,***,,
Sandhurst BMF-Sandhurst Ind Share,2.0065,1.9965,10.35,17.49,****,,
Equity Australia Mid/Small Blend,,
Aberdeen Australian Small Companies,2.5755,2.5627,13.01,16.21,****,,
Ausbil MicroCap,3.4250,3.4045,21.30,29.08,*****,,
BT Smaller Companies Retail,1.8020,1.7940,5.44,12.70,***,,
CFS FC W Inv-CFS W Small Companies Core,1.7227,1.7141,13.76,15.91,****,,
Invesco WS Aus Smaller Companies-Class A,2.1990,2.1836,-10.05,2.84,**,,
Ironbark Karara Australian Small Comp,2.9973,2.9823,5.84,13.25,****,,
NovaPort WS Smaller Companies,2.4026,2.3882,4.08,18.57,****,,
Pengana Emerging Companies,2.3680,2.3538,12.98,19.44,*****,,
Smallco Investment,4.2293,4.1914,15.68,30.45,*****,,
Equity Australia Mid/Small Growth,,
Ausbil Australian Emerging Leaders,3.1439,3.1251,2.12,14.76,***,,
Australian Ethical Australian Shrs,2.2293,2.2289,17.09,18.65,****,,
CFS Developing Companies,2.0454,2.0373,2.70,11.47,****,,
CFS Future Leaders,3.7052,3.6904,-1.68,10.24,***,,
Eley Griffiths Group Small Companies,1.9220,1.9121,5.02,10.66,***,,
Fairview Equity Partners Emerging Co,1.9633,1.9517,4.48,10.40,***,,
Hyperion Small Growth Companies,4.2147,4.1895,12.02,22.47,*****,,
The Montgomery,1.4053,1.3983,13.75,NAv,NAv,,
Equity Australia Mid/Small Value,,
Allan Gray Australia Equity A,1.2065,1.2017,-0.47,14.38,**,,
Perpetual WFIA-Perpetual Small Coms,2.4783,2.4708,6.94,16.26,***,,
Perpetual Wholesale Smaller Companies,1.2061,1.2025,7.76,17.13,***,,
Equity Australia Other,,
Russell After-Tax Aus Shr (SuperInvs) A,1.1976,1.1916,5.59,15.62,NAv,,
Equity Australia Real Estate,,
APN AREIT,1.6275,1.6192,18.93,17.99,****,,
APN Property for Income,2.1537,2.1429,17.75,15.69,****,,
CFS FC W Inv-CFS W Property Securities,0.9030,0.8994,19.71,17.87,***,,
Cromwell Phoenix Property Securities,1.2330,1.2281,18.89,21.42,*****,,
Ibbotson Aus Property Securities Trust,0.4904,0.4885,18.21,17.50,***,,
Ironbark Paladin Property Securities,0.8351,0.8309,18.28,17.67,***,,
SG Hiscock Premier Property Securities,0.8700,0.8666,17.40,18.32,*****,,
SG Hiscock WS Property Securities,0.8045,0.8013,16.56,17.41,****,,
UBS Property Securities,1.0014,0.9944,18.55,19.79,***,,
Equity Emerging Markets,,
Aberdeen Emerging Opportunities,2.4251,2.3986,13.04,12.09,****,,
CFS Wholesale Glb Emerging Markets Sust,1.8023,1.7898,19.17,21.16,*****,,
CFS Wholesale Global Emerging Market,1.6948,1.6830,17.19,16.75,****,,
Russell Emerging Markets Fund Class A,1.2189,1.2091,14.31,15.71,***,,
Walter Scott Emerging Markets,1.2677,1.2625,9.95,10.65,**,,
Equity Europe,,
Platinum European Fund,3.2865,3.2701,15.49,21.59,NAv,,
Equity Global Real Estate,,
Advance Global Property W,0.8942,0.8878,11.24,15.85,***,,
EQT SGH LaSalle Global Listed Prop Secs,1.3071,1.3005,10.80,12.87,**,,
Invesco WS Global Property Secs-Class A,1.2128,1.2044,8.64,13.95,***,,
Ironbark Global (ex-Aus) Property Secs,0.8312,0.8262,11.36,13.53,**,,
Resolution Capital Global Prp Secs (WS),1.8012,1.7904,13.30,16.12,*****,,
Russell Intl Property Secs Hedged A,1.0762,1.0714,10.54,15.15,***,,
UBS Clarion Global Property Securities I,1.3800,1.3745,9.87,13.89,****,,
Equity Global Resources,,
CFS FC W Inv-CFS W Global Resources,1.2962,1.2898,-15.08,-0.61,NAv,,
Equity Japan,,
Platinum Japan,4.0639,4.0436,41.05,37.54,NAv,,
Equity World - Currency Hedged,,
Arrowstreet Global Equity Hedged,0.9427,0.9388,15.10,23.98,*****,,
Grant Samuel Epoch Gbl Eq Shldr Yld Hgd,0.8766,0.8732,4.55,14.46,***,,
Magellan Global (Hedged),1.3010,1.2984,12.45,NAv,NAv,,
Russell International Shares Hedged A,0.8206,0.8174,11.69,19.75,***,,
Walter Scott Global Equity Hedged,1.1403,1.1359,11.35,16.60,**,,
Zurich Investments Hgd Gbl Thematic Shr,1.0542,1.0526,8.21,16.01,**,,
Equity World Large Blend,,
Arrowstreet Global Equity,1.0283,1.0254,29.81,30.68,*****,,
BT International Share Retail,3.6495,3.6457,24.77,25.88,***,,
CFS FC Inv-Platinum International,1.9856,1.9757,19.29,23.32,***,,
CFS FC W Inv-Magellan W Global,2.0581,2.0499,29.74,26.41,****,,
CFS FC W Inv-Platinum International,1.8141,1.8051,20.13,24.16,***,,
CFS Wholesale Indexed Global Share,2.5502,2.5425,24.43,25.58,***,,
Fiducian International Shares,1.6257,1.6143,24.49,23.57,***,,
Ibbotson Core International Eqty UH(SA),0.8813,0.8787,28.78,26.75,****,,
Ibbotson Intl High Opp Unhedged Tr,1.5904,1.5825,24.83,24.91,***,,
IFP Global Franchise,2.3335,2.3221,29.32,25.20,*****,,
IOOF MultiMix International Shares Trust,1.3810,1.3720,22.40,24.56,**,,
Ironbark GTP Global Equity Thematic,1.8975,1.8899,23.10,24.53,**,,
Magellan Global,2.0479,2.0439,29.48,26.43,*****,,
MLC UT/MKey InvSer Platinum Global,2.1486,2.1486,19.50,24.87,***,,
MLC Wholesale Global Share,1.1517,1.1500,23.93,23.91,***,,
Platinum International Brands Fund,2.7062,2.6927,17.42,20.21,***,,
Platinum International Fund,2.1923,2.1813,20.22,24.66,***,,
PM Capital Global Companies,2.5582,2.5454,38.73,36.38,***,,
Russell Global Opportunities A,1.2890,1.2845,27.60,26.03,***,,
Russell International Shares A,1.3972,1.3923,25.90,25.91,***,,
UBS International Share,1.4349,1.4277,21.89,25.69,***,,
Vanguard Index International Shares,1.4884,1.4854,24.44,25.39,***,,
Equity World Large Growth,,
Aberdeen Actively Hedged Intl Equities,3.0164,3.0014,12.01,17.89,**,,
Aberdeen Select Inv Act Hgd Intl Share,1.0808,1.0754,11.79,17.63,**,,
Capital International Global Equity,1.3247,1.3221,24.81,25.82,***,,
Fidelity Global Equities,19.1651,19.0505,28.60,25.66,****,,
Generation Wholesale Global Share,1.5176,1.5115,32.89,28.75,****,,
Walter Scott Global Equity,2.1091,2.1034,25.15,22.35,****,,
Zurich Investments Gbl Thematic Shr,1.8571,1.8541,23.47,22.22,***,,
Zurich Investments Gbl Thematic Shr Pool,1.9022,1.8992,24.64,23.38,****,,
Zurich Investments Uhgd Gbl Thematic Shr,1.6238,1.6212,23.20,22.28,**,,
Zurich Investments Unhedged Global Gr,2.0671,2.0637,25.93,25.31,****,,
Equity World Large Value,,
Aberdeen International Equity,1.1465,1.1408,11.81,17.80,***,,
Altrinsic Global Equities Trust,1.6833,1.6732,25.67,23.40,**,,
Grant Samuel Epoch Gbl Eq Shldr Yld Uhgd,1.3997,1.3941,16.56,21.23,***,,
Perpetual Wholesale International Share,1.7426,1.7340,27.27,24.12,***,,
Peters MacGregor Global,1.8880,1.8842,25.70,20.59,***,,
Platinum Unhedged Fund,1.5601,1.5523,19.47,25.57,***,,
Realindex Global Share-Class A,1.4785,1.4740,20.39,24.02,***,,
Templeton Global Equity,1.3733,1.3679,17.50,27.18,****,,
Wingate Global Equity Fund,1.0367,1.0315,22.98,21.55,***,,
Equity World Mid/Small,,
Fidelity Select Global Small Cap,NAv,13.1826,27.85,29.20,****,,
Hunter Hall Value Growth Trust,3.4141,3.3971,29.90,23.21,***,,
Equity World Other,,
Platinum International Healthcare,2.3120,2.3004,34.00,29.43,NAv,,
Infrastructure - Global,,
Macquarie International Infra Ses,1.2054,1.1994,8.14,16.94,***,,
Magellan Infrastructure,1.1841,1.1805,12.34,17.29,****,,
Magellan Infrastructure (Unhedged),1.5197,1.5151,20.15,NAv,NAv,,
Maple-Brown Abbott Global Listed Infras,1.6024,1.5950,20.01,NAv,NAv,,
RARE Emerging Markets,2.3388,2.3271,19.13,19.29,**,,
RARE Infrastructure Value Hedged,1.2031,1.1989,10.45,15.56,***,,
RARE Infrastructure Value Unhedged,1.4518,1.4468,18.81,20.19,****,,
Australian Short Term Fixed Interest,,
IOOF MultiMix Cash Enhanced Trust,1.0055,1.0055,2.81,3.91,***,,
IOOF/Perennial Flex Cash & Income,1.0000,1.0000,1.73,2.09,*,,
MIF A,1.0212,1.0192,3.23,NAv,NAv,,
Russell Aus Cash Enhanced Fund Class A,1.0295,1.0285,3.10,4.11,****,,
Russell Australian Cash A,1.0304,1.0304,2.21,2.48,**,,
TPS Cash Management,NAv,NAv,2.44,2.68,**,,
UBS Cash Plus,1.0268,1.0252,2.93,3.37,***,,
UCA Enhanced Cash Portfolio,1.0000,1.0000,3.79,4.29,NAv,,
Bonds - Australia,,
Aberdeen Australian Fixed Income,1.1753,1.1735,5.13,4.71,****,,
Altius Bond,1.0119,1.0119,2.92,4.37,***,,
AMP Capital Corporate Bond H,1.0229,1.0188,3.71,5.99,*****,,
CFS FC W Inv-CFS W Australian Bond,1.0978,1.0956,4.52,4.68,**,,
Nikko AM Australian Bond,1.0728,1.0722,5.36,5.04,****,,
Perennial Fixed Interest Wholesale,1.0446,1.0446,4.81,5.66,****,,
Perennial Tactical Income Trust,1.0716,1.0716,2.79,5.13,***,,
PIMCO EQT Wholesale Australian Bond,1.0178,1.0167,5.60,4.84,*****,,
PIMCO EQT Wholesale Australian Focus,1.0326,1.0315,3.85,3.96,**,,
Russell Australian Bond A,1.0593,1.0571,4.65,4.76,****,,
Russell Australian Bond Income,1.0842,1.0832,5.09,4.67,***,,
Schroder Fixed Income Wholesale,1.1121,1.1095,3.86,4.63,****,,
UBS Australian Bond,1.1160,1.1151,4.54,4.72,***,,
Bonds - Global,,
Advance Int Fix Intr Multi-Blend W,1.1003,1.0981,4.63,6.25,*****,,
CFS Wholesale Global Corporate Bond,0.9642,0.9584,4.07,7.75,*****,,
PIMCO EQT Wholesale Global Bond,1.0066,1.0055,5.89,6.56,*****,,
Russell Global Bond B,1.0737,1.0695,1.56,11.36,*****,,
Russell International Bond $A Hedged A,1.0522,1.0480,6.36,7.35,****,,
Bonds - Global / Australia,,
BT WE BT Macquarie Diversified Fixed Int,0.9860,0.9844,2.82,2.77,**,,
CFS FC W Inv-CFS W Diversified Fixed Int,1.0312,1.0271,3.05,4.24,***,,
CFS FC W Inv-FC W Fixed Interest,1.0284,1.0243,5.20,5.33,****,,
Ibbotson Dynamic Income Trust,1.0362,1.0341,4.03,4.58,***,,
IOOF MultiMix Diversified Fixed Interest,1.0027,1.0027,4.21,5.79,****,,
Macquarie Diversified Fixed Interest,1.0218,1.0202,4.01,3.97,***,,
PIMCO EQT WS Diversified Fixed Interest,1.0035,1.0024,5.54,5.60,****,,
UBS Diversified Fixed Income,0.9056,0.9038,3.62,4.99,****,,
Diversified Credit,,
Antares Income Fund,1.0079,1.0079,2.91,NAv,NAv,,
CFS FC W Inv-CFS W Global Credit Income,0.9848,0.9799,2.29,6.40,***,,
Macquarie Income Opportunities,1.0176,1.0146,2.68,5.10,****,,
Omega Global Corporate Bond,1.0570,1.0539,3.91,5.46,***,,
Perpetual Wholesale Diversified Income,0.9674,0.9654,3.55,5.63,***,,
PIMCO EQT Wholesale Global Credit,0.9875,0.9855,4.99,6.13,****,,
PM Capital Enhanced Yield,1.1129,1.1107,2.60,4.65,***,,
Schroder Credit Securities Wholesale,1.0640,1.0598,2.09,5.10,***,,
UBS Diversified Credit,0.9557,0.9519,2.75,6.18,***,,
UBS Global Credit,1.0781,1.0749,3.97,6.79,****,,
High Yield Credit,,
Bentham Wholesale Syndicated Loan,1.0131,1.0051,5.37,8.88,***,,
Mortgages,,
EQT Wholesale Mortgage Income,1.0000,1.0000,4.34,4.99,NAv,,
Sandhurst Select Mortgage,NAv,NAv,3.18,3.56,NAv,,
Tasmanian Perpetual Fixed Term,NAv,NAv,3.52,4.08,NAv,,
Tasmanian Perpetual Long Term,NAv,NAv,3.45,4.07,NAv,,
Tasmanian Perpetual Select Mortgage,NAv,NAv,3.57,4.13,NAv,,
Mortgages Aggressive,,
La Trobe Aust Mortgage Cash & Mortgage,1.0000,1.0000,3.97,4.43,NAv,,
La Trobe Aust Mortgage Pooled Mortgage,1.0000,1.0000,5.97,6.45,NAv,,
Multi-Strategy Income,,
Aberdeen Australian Floating Rt Inc,1.1955,1.1949,2.06,3.06,**,,
Advance Defensive Yield Multi-Blend,1.0466,1.0450,2.64,NAv,NAv,,
Bentham Wholesale Global Income,1.0698,1.0612,3.49,10.95,*****,,
Franklin Templeton Multisector Bond W,1.0918,1.0918,-0.31,8.38,****,,
Kapstream Wholesale Absolute Ret Inc Fd,1.2131,1.2131,3.46,4.99,***,,
Miscellaneous,,
Plato Australian Shares Income,1.3575,1.3521,9.00,18.40,NAv,,
Russell Global Opportunities $NZ Hdg B,1.3795,1.3742,8.06,24.06,NAv,,
Russell Global Opportunities $NZ Hgd A,0.8907,0.8872,9.51,25.45,NAv,,
Australian Cash,,
Adelaide Cash Management Trust,NAv,NAv,1.89,2.20,NAv,,
Advance Cash Multi-Blend,1.0197,1.0197,2.88,3.29,NAv,,
AET Cash Deposit,NAv,NAv,2.00,2.29,NAv,,
AUI Wholesale Cash Fund,1.0000,1.0000,2.91,3.61,NAv,,
BT Cash Management,NAv,NAv,1.69,1.98,NAv,,
BWA Cash Management Trust,NAv,NAv,1.92,2.20,NAv,,
CFS FC W Inv-CFS W Cash,1.0095,1.0095,2.59,2.91,NAv,,
CFS Wholesale Premium Cash,1.0000,1.0000,2.38,2.67,NAv,,
CFS Wholesale Premium Cash Enhanced,1.0000,1.0000,2.59,2.78,NAv,,
EQT Cash Management,1.0000,1.0000,1.83,1.93,NAv,,
Mutual Cash Term Deposits & Bank Bills,1.0414,1.0414,3.07,3.63,NAv,,
Ord Minnett Cash Management,NAv,NAv,1.53,2.06,NAv,,
Sandhurst Cash Common Fund,NAv,NAv,1.90,2.13,NAv,,
The Development Fund,1.0000,1.0000,3.38,3.82,NAv,,
UBS Cash,1.0456,1.0456,2.48,2.81,NAv,,
Unlisted and Direct Property,,
AUI Diversified Property Fund,0.7746,0.7667,9.18,10.01,NAv,,
AUI Healthcare Property Trust A,0.9658,0.9394,6.74,7.53,NAv,,
AUI Healthcare Property Trust R,1.4260,1.3776,7.42,8.15,NAv,,
AUI Healthcare Property Trust W,1.3975,1.3500,7.95,8.76,NAv,,
AUI Office Property Fund,0.8156,0.8074,14.37,10.46,NAv,,
Charter Hall Direct Office,NAv,0.8632,32.25,15.63,NAv,,
,
